{
  "$schema": "https://json-schema.org/draft/2020-12/schema",
  "type": "object",
  "properties": {
    "metadata": {
      "type": "object",
      "additionalProperties": true
    },
    "defaults": {
      "type": "object",
      "additionalProperties": true
    },
    "alias_hints": {
      "type": "object",
      "additionalProperties": {
        "type": "array",
        "items": {
          "type": "string"
        }
      }
    },
    "normalizers": {
      "type": "object",
      "additionalProperties": true
    },
    "atoms_embedded": {
      "type": "object",
      "properties": {
        "metadata": {
          "type": "object",
          "additionalProperties": true
        },
        "atoms": {
          "type": "array",
          "items": {
            "type": "object",
            "required": [
              "pattern_id",
              "regex"
            ],
            "properties": {
              "pattern_id": {
                "type": "string"
              },
              "description": {
                "type": [
                  "string",
                  "null"
                ]
              },
              "regex": {
                "type": "array",
                "items": {
                  "type": "string"
                }
              },
              "normalizers": {
                "type": "array",
                "items": {
                  "type": "string"
                }
              },
              "validation": {
                "type": "object",
                "additionalProperties": true
              }
            },
            "additionalProperties": true
          }
        }
      },
      "additionalProperties": true
    },
    "patterns": {
      "type": "array",
      "items": {
        "type": "object",
        "required": [
          "property_id",
          "regex"
        ],
        "properties": {
          "property_id": {
            "type": "string"
          },
          "regex": {
            "type": "array",
            "items": {
              "type": [
                "string",
                "object"
              ]
            }
          },
          "normalizers": {
            "type": "array",
            "items": {
              "type": "string"
            }
          },
          "tags": {
            "type": "array",
            "items": {
              "type": "string"
            }
          },
          "confidence": {
            "type": [
              "number",
              "null"
            ]
          },
          "defaults": {
            "type": "object",
            "additionalProperties": true
          }
        },
        "additionalProperties": true
      }
    }
  },
  "required": [
    "patterns"
  ],
  "additionalProperties": true
}
