{
    "metadata": {
        "version": "2024-05-01",
        "description": "Regex property extraction pack for Italian/European construction specifications",
        "language": [
            "it",
            "en"
        ],
        "domain": "construction"
    },
    "defaults": {
        "normalizers": [
            "strip"
        ],
        "selection_strategy": "best_confidence"
    },
    "normalizers": {
        "map_enum:serr_materiale": {
            "legno": "legno",
            "legno massello": "legno",
            "alluminio": "alluminio",
            "lega di alluminio": "alluminio",
            "pvc": "pvc",
            "cloruro di polivinile": "pvc",
            "legno-alluminio": "legno-alluminio",
            "alluminio-legno": "legno-alluminio",
            "legno / alluminio": "legno-alluminio",
            "acciaio": "acciaio"
        },
        "map_enum:vetro_tipologia": {
            "camera": "camera",
            "doppia camera": "camera",
            "tripla camera": "camera",
            "float": "float",
            "monolitico": "float",
            "laminato": "laminato",
            "stratificato": "laminato",
            "temprato": "temprato",
            "indurito": "temprato"
        },
        "map_enum:gyp_orditura_tipo": {
            "ms48": "MS48",
            "ms 48": "MS48",
            "ms75": "MS75",
            "ms 75": "MS75",
            "ua": "UA",
            "ua50": "UA50",
            "ua 50": "UA50"
        }
    },
    "patterns": [
        {
            "property_id": "serr.permeabilita_aria_classe",
            "regex": [
                "(?i)\\bEN\\s*12207\\b[^\\n]{0,50}?\\bclasse\\s*(?P<val>[1-4])\\b",
                "(?i)\\bpermeabilit[a\u00e0]\\s*all'?aria\\b[^\\n]{0,40}?\\bclasse\\s*(?P<val>[1-4])\\b",
                "(?i)\\bclasse\\s*(?P<val>[1-4])\\b[^\\n]{0,30}?\\bEN\\s*12207\\b"
            ],
            "normalizers": [
                "class_norm:EN12207"
            ],
            "language": "it",
            "confidence": 0.92,
            "tags": [
                "serramenti",
                "prestazioni",
                "norma:EN12207"
            ],
            "unit": null,
            "examples": [
                "Serramento certificato EN 12207 classe 4",
                "Permeabilit\u00e0 all'aria: classe 3 secondo EN 12207",
                "Prestazione EN12207: classe 4 per serramento scorrevole",
                "Classe di permeabilit\u00e0 all\u2019aria richiesta \u2265 classe 2 EN 12207",
                "La finestra garantisce permeabilit\u00e0 all'aria classe 1 (EN 12207)"
            ],
            "first_wins": true
        },
        {
            "property_id": "serr.tenuta_acqua_classe",
            "regex": [
                "(?i)\\bEN\\s*12208\\b[^\\n]{0,50}?\\bclasse\\s*(?P<val>[0-9]\\s*[AB])\\b",
                "(?i)\\btenuta\\s*all'?acqua\\b[^\\n]{0,40}?\\bclasse\\s*(?P<val>[0-9]\\s*[AB])\\b",
                "(?i)\\bclasse\\s*(?P<val>[0-9]\\s*[AB])\\b[^\\n]{0,30}?\\bEN\\s*12208\\b"
            ],
            "normalizers": [
                "class_norm:EN12208"
            ],
            "language": "it",
            "confidence": 0.9,
            "tags": [
                "serramenti",
                "prestazioni",
                "norma:EN12208"
            ],
            "unit": null,
            "examples": [
                "Tenuta all\u2019acqua certificata EN 12208 classe 9A",
                "Classe di tenuta all'acqua: 7A secondo EN 12208",
                "Richiesta tenuta acqua \u2265 classe 6A (EN12208)",
                "Prova EN 12208 classe 5B per serramento scorrevole",
                "Serramento con classe 3A alla tenuta all'acqua EN 12208"
            ],
            "first_wins": true
        },
        {
            "property_id": "serr.resistenza_vento_classe",
            "regex": [
                "(?i)\\bEN\\s*12210\\b[^\\n]{0,50}?\\bclasse\\s*(?P<val>[ABC]\\s*[1-5])\\b",
                "(?i)\\bresistenza\\s+al\\s+vento\\b[^\\n]{0,40}?\\bclasse\\s*(?P<val>[ABC]\\s*[1-5])\\b",
                "(?i)\\bclasse\\s*(?P<val>[ABC]\\s*[1-5])\\b[^\\n]{0,30}?\\bEN\\s*12210\\b"
            ],
            "normalizers": [
                "class_norm:EN12210"
            ],
            "language": "it",
            "confidence": 0.9,
            "tags": [
                "serramenti",
                "prestazioni",
                "norma:EN12210"
            ],
            "unit": null,
            "examples": [
                "Resistenza al vento EN 12210 classe C5",
                "Classe di resistenza al vento \u2265 B3 (EN12210)",
                "Prova EN 12210: classe A2 per serramento a nastro",
                "Resistenza al vento certificata classe C4 secondo EN 12210",
                "Serramento garantito in classe B4 alla resistenza al vento"
            ],
            "first_wins": true
        },
        {
            "property_id": "vetro.Ug_Wm2K",
            "regex": [
                "(?i)\\bUg\\s*[:=]?\\s*(?:\u2265|<=|>=|\u2264|almeno|max\\.?|non\\s+superiore\\s+a)?\\s*(?P<val>\\d+(?:[.,]\\d+)?)\\s*(?:W\\s*/\\s*m\\s*(?:\u00b2|2)|W/m2K?|W\\s*/\\s*m\\s*\u00b2\\s*K)\\b",
                "(?i)\\btrasmittanza\\s+vetro\\b[^\\n]{0,40}?\\b(?P<val>\\d+(?:[.,]\\d+)?)\\s*(?:W\\s*/\\s*m\\s*(?:\u00b2|2)|W/m2K?)\\b"
            ],
            "normalizers": [
                "to_number"
            ],
            "language": "it",
            "confidence": 0.9,
            "tags": [
                "serramenti",
                "vetri",
                "termica"
            ],
            "unit": "W/m\u00b2K",
            "examples": [
                "Ug = 1,1 W/m\u00b2K",
                "Trasmittanza vetro pari a 0.8 W/m2K",
                "Prestazione Ug \u2264 1.0 W/m\u00b2K",
                "Ug richiesto almeno 1,2 W/m2",
                "Il vetro camera ha Ug 0.6 W/m\u00b2K"
            ]
        },
        {
            "property_id": "vetro.g",
            "regex": [
                "(?i)\\bg[-\\s]*value\\b[^\\n]{0,20}?[:=]?\\s*(?P<val>\\d+(?:[.,]\\d+)?)(?:\\s*%)?",
                "(?i)\\bfattore\\s+(?:solare|g)\\b[^\\n]{0,30}?[:=]?\\s*(?P<val>\\d+(?:[.,]\\d+)?)(?:\\s*%)?",
                "(?i)\\bg\\s*=\\s*(?P<val>\\d+(?:[.,]\\d+)?)(?:\\s*%)?"
            ],
            "normalizers": [
                "percent_to_ratio"
            ],
            "language": "it",
            "confidence": 0.82,
            "tags": [
                "serramenti",
                "vetri",
                "solare"
            ],
            "unit": null,
            "examples": [
                "g-value = 0,55",
                "Fattore solare g pari al 45%",
                "Valore g richiesto \u2264 0.35",
                "g = 52% per il vetro selettivo",
                "Fattore solare complessivo g=0.42"
            ]
        },
        {
            "property_id": "vetro.spessore_lastra_mm",
            "regex": [
                "(?i)\\bspessore\\s+(?:della\\s+)?lastra\\b[^\\n]{0,40}?[:=]?\\s*(?:\u2265|<=|>=|\u2264|almeno|max\\.?|non\\s+inferiore\\s+a)?\\s*(?P<val>\\d+(?:[.,]\\d+)?)(?:\\s*(?P<unit>mm|cm|m))\\b",
                "(?i)\\bvetro\\s*(?:float|laminato|camera)?\\b[^\\n]{0,30}?\\b(?P<val>\\d+(?:[.,]\\d+)?)(?:\\s*(?P<unit>mm|cm|m))\\b",
                "(?i)\\blastra\\s+(?:esterna|interna)\\b[^\\n]{0,20}?\\b(?P<val>\\d+(?:[.,]\\d+)?)(?:\\s*(?P<unit>mm|cm|m))\\b"
            ],
            "normalizers": [
                "to_unit:mm"
            ],
            "language": "it",
            "confidence": 0.84,
            "tags": [
                "serramenti",
                "vetri",
                "geometria"
            ],
            "unit": "mm",
            "examples": [
                "Spessore lastra esterna 6 mm",
                "Vetro stratificato 8,76 mm",
                "Lastra interna almeno 4 mm",
                "Spessore della lastra pari a 10 mm",
                "Lastre camera: vetro interno 5 mm"
            ]
        },
        {
            "property_id": "vetro.tipologia",
            "regex": [
                "(?i)\\bvetro\\s+(?P<val>camera|doppia\\s+camera|tripla\\s+camera|laminato|stratificato|float|monolitico|temprato|indurito)\\b",
                "(?i)\\btipologia\\s+vetro\\b[^\\n]{0,40}?[:=]?\\s*(?P<val>camera|doppia\\s+camera|laminato|temprato|float|stratificato)"
            ],
            "normalizers": [
                "lower",
                "map_enum:vetro_tipologia"
            ],
            "language": "it",
            "confidence": 0.78,
            "tags": [
                "serramenti",
                "vetri",
                "materiale"
            ],
            "unit": null,
            "examples": [
                "Vetro camera 6/16/6 basso emissivo",
                "Tipologia vetro: laminato antieffrazione",
                "Lastre in vetro float temperato",
                "Serramento con vetro tripla camera",
                "Specifica vetro: monolitico temprato"
            ]
        },
        {
            "property_id": "serr.trasmittanza_UW",
            "regex": [
                "(?i)\\bU[u2093x]?w\\b\\s*[:=]?\\s*(?:\u2265|<=|>=|\u2264|almeno|max\\.?|non\\s+superiore\\s+a)?\\s*(?P<val>\\d+(?:[.,]\\d+)?)\\s*(?:W\\s*/\\s*m\\s*(?:\u00b2|2)|W/m2K?|W\\s*/\\s*m\\s*\u00b2\\s*K)\\b",
                "(?i)\\btrasmittanza\\s+termica\\s+del\\s+serramento\\b[^\\n]{0,40}?(?:\u2265|<=|>=|\u2264|almeno|max\\.?|non\\s+superiore\\s+a)?\\s*(?P<val>\\d+(?:[.,]\\d+)?)\\s*(?:W\\s*/\\s*m\\s*(?:\u00b2|2)|W/m2K?|W\\s*/\\s*m\\s*\u00b2\\s*K)\\b"
            ],
            "normalizers": [
                "to_number"
            ],
            "language": "it",
            "confidence": 0.9,
            "tags": [
                "serramenti",
                "termica"
            ],
            "unit": "W/m\u00b2K",
            "examples": [
                "Uw = 1,3 W/m\u00b2K",